{
  "format": "byteoffer.qbank",
  "schemaVersion": 1,
  "meta": {
    "title": "ByteOffer 核心题库",
    "locale": "zh-CN"
  },
  "questions": [
    {
      "id": "html-semantic-001",
      "type": "single_choice",
      "difficulty": "easy",
      "tags": [
        "HTML",
        "语义化"
      ],
      "stem": "下列哪个 HTML5 元素最适合标记页面主体中一段“与周围内容相对独立、可单独分发或复用”的内容（如一篇博客文章或一条评论）？",
      "options": [
        {
          "k": "A",
          "t": "section"
        },
        {
          "k": "B",
          "t": "article"
        },
        {
          "k": "C",
          "t": "div"
        },
        {
          "k": "D",
          "t": "aside"
        }
      ],
      "answer": "B",
      "explanation": {
        "explain": "article 表示文档中一段自包含、可独立于其余内容分发或复用的内容，典型如博客文章、新闻报道、论坛帖子或评论。section 表示主题相关的一组内容，通常带有标题，但不强调可独立分发。div 是无语义的通用容器，aside 表示与主内容间接相关的旁支内容（如侧边栏）。语义化选择应以“内容含义”为依据，而非视觉表现。",
        "points": [
          "article 强调内容可独立分发或复用",
          "section 是主题分组，通常需要标题",
          "div 无语义，仅作样式或脚本钩子",
          "aside 表示旁支或补充内容"
        ],
        "pitfalls": [
          "把 section 当作无语义分组容器滥用",
          "误以为 article 只能用于长文章而不能用于评论或卡片"
        ],
        "related": [
          "HTML5 语义化标签",
          "文档大纲算法",
          "可访问性与地标角色"
        ]
      }
    },
    {
      "id": "html-viewport-002",
      "type": "single_choice",
      "difficulty": "easy",
      "tags": [
        "HTML",
        "meta",
        "移动端"
      ],
      "stem": "为使页面在移动端按设备宽度渲染并保持初始 1:1 缩放，下列 meta viewport 配置正确的是？",
      "options": [
        {
          "k": "A",
          "t": "<meta name=\"viewport\" content=\"width=320, initial-scale=2\">"
        },
        {
          "k": "B",
          "t": "<meta name=\"viewport\" content=\"width=device-width, initial-scale=1.0\">"
        },
        {
          "k": "C",
          "t": "<meta charset=\"utf-8\">"
        },
        {
          "k": "D",
          "t": "<meta name=\"viewport\" content=\"height=device-height\">"
        }
      ],
      "answer": "B",
      "explanation": {
        "explain": "width=device-width 让布局视口宽度等于设备的理想视口宽度，initial-scale=1.0 使初始缩放比例为 1:1，二者配合是移动端响应式布局的标准写法。选项 A 固定宽度且初始放大 2 倍，会破坏响应式；C 是字符编码声明，与视口无关；D 只设高度不设宽度，无法正确适配。现代实践一般不再用 maximum-scale 或 user-scalable 去禁用缩放，以免损害可访问性。",
        "points": [
          "width=device-width 使布局视口等于理想视口",
          "initial-scale=1.0 保证初始 1:1 缩放",
          "charset 与 viewport 是两类不同的 meta",
          "不建议禁用用户缩放以保障无障碍"
        ],
        "pitfalls": [
          "固定 width 数值导致无法自适应",
          "混淆布局视口与视觉视口"
        ],
        "related": [
          "响应式设计",
          "布局视口与视觉视口",
          "移动端适配方案"
        ]
      }
    },
    {
      "id": "html-form-003",
      "type": "multiple_choice",
      "difficulty": "medium",
      "tags": [
        "HTML",
        "表单",
        "input"
      ],
      "stem": "关于 HTML 表单与原生约束校验，下列说法正确的有哪些？",
      "options": [
        {
          "k": "A",
          "t": "required 属性可让浏览器在提交时对空值进行原生校验并阻止提交"
        },
        {
          "k": "B",
          "t": "type=email 的输入框会由浏览器做基本的邮箱格式校验"
        },
        {
          "k": "C",
          "t": "在 form 上设置 novalidate 会关闭该表单的原生约束校验"
        },
        {
          "k": "D",
          "t": "label 的 for 属性值应与目标控件的 name 属性一致才能建立关联"
        }
      ],
      "answer": [
        "A",
        "B",
        "C"
      ],
      "explanation": {
        "explain": "required、type=email、pattern 等构成 HTML 约束校验能力，浏览器会在提交时据此拦截非法输入；在表单上加 novalidate、或在提交按钮上加 formnovalidate 可关闭这一校验。label 的 for 关联的是目标控件的 id 而非 name，因此 D 错误。name 用于表单序列化提交，id 用于页面内唯一标识与关联，二者用途不同。合理使用原生校验能减少 JS 代码并提升可访问性，但不能替代服务端校验。",
        "points": [
          "required、type、pattern 触发原生约束校验",
          "novalidate、formnovalidate 关闭校验",
          "label 的 for 关联的是控件 id",
          "name 用于提交，id 用于关联"
        ],
        "pitfalls": [
          "混淆 for 应指向 id 还是 name",
          "以为原生校验能取代服务端校验"
        ],
        "related": [
          "约束校验 API",
          "表单可访问性",
          "自定义校验 setCustomValidity"
        ]
      }
    },
    {
      "id": "html-script-004",
      "type": "true_false",
      "difficulty": "medium",
      "tags": [
        "HTML",
        "script",
        "性能"
      ],
      "stem": "带 defer 的外部脚本会在 HTML 解析的同时并行下载，并被推迟到文档解析完成后、按其在文档中出现的顺序、在 DOMContentLoaded 事件触发之前依次执行。该说法是否正确？",
      "answer": true,
      "explanation": {
        "explain": "defer 使脚本异步下载而不阻塞 HTML 解析，脚本被推迟到文档解析完成后、DOMContentLoaded 之前按文档顺序依次执行，因此多个 defer 脚本能保证相对执行顺序。这与 async 不同：async 同样并行下载，但下载完成后立即执行、不保证顺序，也可能早于解析完成。defer 只对带 src 的外部脚本生效，对内联脚本无效。它是既不阻塞渲染又需保持依赖顺序脚本的推荐加载方式。",
        "points": [
          "defer 并行下载且不阻塞解析",
          "按文档顺序执行，位于 DOMContentLoaded 之前",
          "async 不保证顺序且下载完即执行",
          "defer 仅对外部脚本生效"
        ],
        "pitfalls": [
          "混淆 defer 与 async 的执行时机与顺序",
          "对内联脚本使用 defer 期望其生效"
        ],
        "related": [
          "async 属性",
          "DOMContentLoaded 与 load 事件",
          "脚本加载性能优化"
        ]
      }
    },
    {
      "id": "html-a11y-005",
      "type": "short_answer",
      "difficulty": "hard",
      "tags": [
        "HTML",
        "可访问性",
        "ARIA"
      ],
      "stem": "简述在什么场景下应使用 ARIA 属性（如 role、aria-label、aria-live），以及“优先使用原生语义元素而非 ARIA”这一原则的含义。",
      "reference": "ARIA 用于在原生 HTML 语义无法表达时补充可访问性信息，例如用 div 实现的自定义 tab、dialog、tree 等组件，需要 role 说明角色、aria-label 或 aria-labelledby 提供无障碍名称、aria-live 声明动态区域的更新播报方式。但 ARIA 只改变辅助技术读到的语义，不提供任何行为，键盘操作与焦点管理仍需自行实现。“优先原生语义”指能用 button、nav、input 等原生元素时就不要用 div 加 role 去模拟，因为原生元素自带语义、焦点与键盘行为；误用 ARIA 反而可能覆盖或破坏原有语义，即所谓“No ARIA is better than bad ARIA”。",
      "keywords": [
        "role",
        "aria-label",
        "aria-live",
        "原生语义优先",
        "No ARIA is better than bad ARIA",
        "键盘可达"
      ],
      "selfAssess": true,
      "explanation": {
        "explain": "现代无障碍开发的核心是语义优先：HTML 原生元素已内建角色、状态与键盘交互，能满足绝大多数需求。ARIA 是补充层，仅在原生语义不足以描述自定义交互组件时使用，用来向屏幕阅读器等辅助技术暴露角色 role、名称 aria-label、状态如 aria-expanded 与动态更新 aria-live。关键前提是 ARIA 只改语义不加行为，开发者仍须自行实现焦点管理与键盘操作。滥用或错误的 ARIA 会覆盖原生语义、误导用户，故有“No ARIA is better than bad ARIA”之诫。",
        "points": [
          "原生语义元素自带角色、焦点与键盘行为",
          "ARIA 用于补足自定义组件的语义",
          "aria-live 声明动态内容的播报",
          "ARIA 只改语义，不提供行为"
        ],
        "pitfalls": [
          "用 div 加 role 重造 button 却忘了键盘可达",
          "滥用 ARIA 覆盖或破坏原生语义"
        ],
        "related": [
          "WAI-ARIA 设计模式",
          "语义化 HTML",
          "键盘可访问性"
        ]
      }
    },
    {
      "id": "css-boxmodel-001",
      "type": "single_choice",
      "difficulty": "easy",
      "tags": [
        "CSS",
        "盒模型",
        "box-sizing"
      ],
      "stem": "一个元素设置 width:200px; padding:20px; border:5px solid; box-sizing:border-box; 那么它在页面上占据的边框盒总宽度（含 content、padding、border，不含 margin）是多少？",
      "options": [
        {
          "k": "A",
          "t": "200px"
        },
        {
          "k": "B",
          "t": "240px"
        },
        {
          "k": "C",
          "t": "250px"
        },
        {
          "k": "D",
          "t": "230px"
        }
      ],
      "answer": "A",
      "explanation": {
        "explain": "box-sizing:border-box 时，width 指定的是包含 content、padding 与 border 在内的边框盒总宽度，因此总宽度就是 200px，内容区宽度被压缩为 200 减去左右 padding 40 再减去左右 border 10，等于 150px。若为默认的 content-box，width 只表示内容区，总宽会是 200 加 40 加 10 等于 250px。border-box 便于布局计算，是许多 CSS Reset 的默认设置。margin 永远不计入元素自身的盒宽度。",
        "points": [
          "border-box 下 width 含 content、padding、border",
          "content-box（默认）下 width 仅为内容区",
          "本例总宽为 200px，内容区为 150px",
          "margin 不计入盒宽"
        ],
        "pitfalls": [
          "默认 content-box 下忽略 padding、border 撑大元素",
          "把 margin 也算进 width"
        ],
        "related": [
          "标准盒模型与怪异盒模型",
          "CSS Reset",
          "外边距合并"
        ]
      }
    },
    {
      "id": "css-specificity-002",
      "type": "single_choice",
      "difficulty": "easy",
      "tags": [
        "CSS",
        "选择器",
        "优先级"
      ],
      "stem": "下列四个选择器作用于同一元素，哪一个的优先级（specificity）最高？",
      "options": [
        {
          "k": "A",
          "t": "#nav .item a"
        },
        {
          "k": "B",
          "t": "div.item.active"
        },
        {
          "k": "C",
          "t": "ul li a.link"
        },
        {
          "k": "D",
          "t": ".item:hover"
        }
      ],
      "answer": "A",
      "explanation": {
        "explain": "优先级按四元组（行内、id、类或伪类或属性、元素或伪元素）比较。A 含 1 个 id、1 个类、1 个元素，权重为 0,1,1,1；B 为 0,0,2,1；C 为 0,0,1,3；D 为 0,0,2,0。逐段从高位到低位比较，id 段更大者直接胜出，A 是唯一含 id 的选择器，故优先级最高。只要高位段更大，低位段再多也无法翻盘，即 id 恒高于任意数量的类。",
        "points": [
          "specificity 四元组：行内、id、类、元素",
          "逐段从高到低比较，高位段一票否决",
          "id 高于任意多个类",
          "伪类计入类段，伪元素计入元素段"
        ],
        "pitfalls": [
          "误以为选择器越长优先级越高",
          "把伪元素当伪类计入类段"
        ],
        "related": [
          "!important 与层叠",
          ":where() 的零优先级",
          "@layer 层叠层"
        ]
      }
    },
    {
      "id": "css-flexbox-003",
      "type": "multiple_choice",
      "difficulty": "medium",
      "tags": [
        "CSS",
        "Flexbox",
        "布局"
      ],
      "stem": "关于 Flexbox 弹性布局，下列说法正确的有哪些？",
      "options": [
        {
          "k": "A",
          "t": "flex:1 是 flex-grow:1; flex-shrink:1; flex-basis:0% 的简写"
        },
        {
          "k": "B",
          "t": "justify-content 控制主轴方向上的对齐，align-items 控制交叉轴方向上的对齐"
        },
        {
          "k": "C",
          "t": "默认 flex-direction 为 row，主轴为水平方向"
        },
        {
          "k": "D",
          "t": "align-items 的默认值是 center"
        }
      ],
      "answer": [
        "A",
        "B",
        "C"
      ],
      "explanation": {
        "explain": "flex:1 展开即 flex-grow:1、flex-shrink:1、flex-basis:0%，表示项目按剩余空间等比伸展。主轴由 flex-direction 决定，默认 row 即水平方向，justify-content 沿主轴对齐、align-items 沿交叉轴对齐。align-items 的默认值是 stretch，即在交叉轴上拉伸填满，而非 center，故 D 错误。理解主轴与交叉轴会随 flex-direction 变化，是掌握 Flexbox 的关键。",
        "points": [
          "flex:1 等于 grow1、shrink1、basis0%",